{"schemaVersion":"1.0.0","id":"fixture-policy","version":"1.0.0","description":"Fixture policy","allowedOrigins":["http://127.0.0.1:58716"],"allowedRoutes":[{"id":"login","pattern":"^/login$"},{"id":"landing","pattern":"^/landing$"},{"id":"protected","pattern":"^/protected$"}],"allowedActions":["navigate","activate","enterText","extract"],"deniedActions":[],"riskByAction":{"navigate":"navigation","activate":"read","enterText":"input","selectOption":"input","pressKey":"input","scroll":"read","wait":"read","extract":"read"},"allowedSecretReferences":["FIXTURE_USERNAME","FIXTURE_PASSWORD"],"allowedSecretStepIds":["enter-username","enter-password","recovery-enter-username","recovery-enter-password"],"screenshotRules":{"enabled":true,"forbidWhileSecretFieldPopulated":true},"traceRules":{"enabled":false,"startAfterAuthentication":true},"navigation":{"allowExternal":false,"maxNavigations":12},"downloads":"deny","uploads":"deny","maxReplayDurationMs":30000,"maxActionAttempts":2,"authenticationRecovery":{"allowed":true,"maxAttempts":1},"interventionActions":[],"defaultDecision":"deny","metadata":{"createdAt":"2026-09-30T00:00:00Z"}}